{
  "schema_version": "aprof.diagnosis-retrieval/v1",
  "task_id": "raw-case-11",
  "context_hash": "sha256:3fea6a2634c83525f1111cd72829e945893e4d1c15a89f6be6501ede1bc45a03",
  "knowledge_hash": "sha256:484e2107fbff032161df166d17b7be3b4ace2a34b8f98a843a1d9a629d0f3dc5",
  "graph_version": "v0005",
  "source_context_ref": {
    "path": "source-authority.json",
    "sha256": "sha256:4f46f610bcca04ba204d095fb8228c259e0d0c26fe4d153f4a1293d607bda49c"
  },
  "problem_directory": [
    {
      "id": "problem.broadcast_strategy_mismatch",
      "title": "广播方案与连续性或复用不匹配",
      "mechanism": "广播方式没有利用连续内轴或小输入复用 → 重复从GM读取或在UB中反复扩展/Scalar索引 → 额外读流量、展开临时区与控制开销进入关键路径",
      "mechanism_summary": "广播方式没有利用连续内轴或小输入复用 → 重复从GM读取或在UB中反复扩展/Scalar索引 → 额外读流量、展开临时区与控制开销进入关键路径",
      "alternatives": [
        {
          "check": "把广播轴和非广播物理stride分开",
          "distinction": "零stride广播复用与物理跨stride不是同一条件",
          "problem_id": "problem.noncontiguous_access"
        },
        {
          "check": "分开profile广播展开与CopyIn",
          "distinction": "本项还涉及展开和索引成本，未必都有GM重复读",
          "problem_id": "problem.insufficient_input_reuse"
        }
      ],
      "discriminating_checks": [
        "分别计算输出元素数和每输入唯一字节，不用输出字节当输入下界",
        "同轴合并后已为高效逐元素路径或输入无复用需求时，不支持本项"
      ],
      "scope_status": "match",
      "scope": {
        "dtypes": [
          "all"
        ],
        "platforms": [
          "all"
        ],
        "workloads": [
          "all"
        ]
      },
      "slots": [
        {
          "description": "具有广播轴零stride、连续内轴与多个输入的输出域",
          "kind": "object",
          "name": "target",
          "required": true
        },
        {
          "description": "host合轴与切分；kernel GM搬入、UB展开及计算",
          "kind": "stage",
          "name": "stage",
          "required": true
        },
        {
          "description": "绑定shape、dtype、layout、feature与有效元素域，不跨workload借证据",
          "kind": "workload",
          "name": "workload",
          "required": true
        },
        {
          "description": "绑定当前parent源码、host/tiling/kernel、编译配置或artifact身份",
          "kind": "implementation",
          "name": "implementation",
          "required": true
        }
      ],
      "source_path": "skills/ascendc-aprof-diagnosis/graph/problems/problem.broadcast_strategy_mismatch.md",
      "source_hash": "sha256:1b2609ac77d163bda7a1992cd1e36fbc698fac4bfd4b1140afc3298472a38fb1",
      "review": {
        "discriminating_power": "分别计算输出元素数和每输入唯一字节，不用输出字节当输入下界；按目标rank/axis/dtype与原始维度字节对齐核对可选API；同轴合并后已为高效逐元素路径或输入无复用需求时，不支持本项",
        "gaps": [
          "尚无当前任务同scope的profiling关联或独立硬件复核；所有效果为prediction。",
          "DAV_2201静态Broadcast与DAV_3510动态/NDDMA不可互代",
          "原始shape的约束必须保留，不能拿padding假满足"
        ],
        "observed_frequency": "unknown",
        "source_credibility": "固定修订的API文档、策略说明或公开代码；新claim独立引用本包来源与行号。旧迁移引用只作为legacy_seed，仓库名不自动等于硬件证明。",
        "state": "reviewed_with_limits"
      }
    },
    {
      "id": "problem.cache_policy_mismatch",
      "title": "缓存策略与复用模式不匹配",
      "mechanism": "一次性流量和待复用数据采用不合适的缓存策略或共享工作集超过有效L2 → 缓存填充/替换增加成本，或重复访问未命中 → 额外GM访问或缓存管理影响关键路径",
      "mechanism_summary": "一次性流量和待复用数据采用不合适的缓存策略或共享工作集超过有效L2 → 缓存填充/替换增加成本，或重复访问未命中 → 额外GM访问或缓存管理影响关键路径",
      "alternatives": [
        {
          "check": "核对Copy次数、L2命中和GM实际字节",
          "distinction": "缺少软件驻留与cache miss会共存，前者不要求hint错误",
          "problem_id": "problem.insufficient_input_reuse"
        },
        {
          "check": "同时检查重复读来源与持续带宽",
          "distinction": "缓存策略是字节/替换原因，带宽饱和是资源状态",
          "problem_id": "problem.memory_bandwidth_saturation"
        }
      ],
      "discriminating_checks": [
        "按访问对象而非算子整体命中率划分，比较同一访问模式下的策略",
        "低命中只来自首次或一次性读取时，不证明策略错误"
      ],
      "scope_status": "match",
      "scope": {
        "dtypes": [
          "all"
        ],
        "platforms": [
          "all"
        ],
        "workloads": [
          "all"
        ]
      },
      "slots": [
        {
          "description": "具有明确访问次数和复用距离的GlobalTensor及其L2策略",
          "kind": "object",
          "name": "target",
          "required": true
        },
        {
          "description": "kernel GlobalTensor策略设置；多次读写与cache替换窗口",
          "kind": "stage",
          "name": "stage",
          "required": true
        },
        {
          "description": "绑定shape、dtype、layout、feature与有效元素域，不跨workload借证据",
          "kind": "workload",
          "name": "workload",
          "required": true
        },
        {
          "description": "绑定当前parent源码、host/tiling/kernel、编译配置或artifact身份",
          "kind": "implementation",
          "name": "implementation",
          "required": true
        }
      ],
      "source_path": "skills/ascendc-aprof-diagnosis/graph/problems/problem.cache_policy_mismatch.md",
      "source_hash": "sha256:aee27ffd949c6af1597258edfd3416e2b06e61561b670b53916dde422af40a39",
      "review": {
        "discriminating_power": "按访问对象而非算子整体命中率划分，比较同一访问模式下的策略；一次性输入先比较禁用/默认的成本，不假定启用必快；低命中只来自首次或一次性读取时，不证明策略错误",
        "gaps": [
          "尚无当前任务同scope的profiling关联或独立硬件复核；所有效果为prediction。",
          "不同产品支持情况按源API表复核",
          "禁止以枚举存在推断PERSISTENT可用"
        ],
        "observed_frequency": "unknown",
        "source_credibility": "固定修订的API文档、策略说明或公开代码；新claim独立引用本包来源与行号。旧迁移引用只作为legacy_seed，仓库名不自动等于硬件证明。",
        "state": "reviewed_with_limits"
      }
    },
    {
      "id": "problem.chunk_merge_overhead",
      "title": "跨 chunk 合并开销过高",
      "mechanism": "增加分段缩短主阶段关键路径却制造更多partial状态 → 每段额外写回、同步、读回及合并 → 当合并随段数增快，额外成本超过并行节省",
      "mechanism_summary": "增加分段缩短主阶段关键路径却制造更多partial状态 → 每段额外写回、同步、读回及合并 → 当合并随段数增快，额外成本超过并行节省",
      "alternatives": [
        {
          "check": "扫描合法段数并分阶段计成本",
          "distinction": "少分段可欠并行，多分段可合并昂贵，是资源取舍",
          "problem_id": "problem.underused_task_parallelism"
        },
        {
          "check": "按实际partial索引与分配段分别计字节",
          "distinction": "必要partial流量与未访问的多余预留不同",
          "problem_id": "problem.workspace_overallocation"
        }
      ],
      "discriminating_checks": [
        "比较saved_critical_path与partial_write+sync+read+merge，而非只比较活跃核数",
        "分段仍显著缩短全链关键路径时，不能因存在merge就判过度"
      ],
      "scope_status": "match",
      "scope": {
        "dtypes": [
          "all"
        ],
        "platforms": [
          "all"
        ],
        "workloads": [
          "all"
        ]
      },
      "slots": [
        {
          "description": "被分段的归约/KV/K域及其partial、合并阶段",
          "kind": "object",
          "name": "target",
          "required": true
        },
        {
          "description": "host分段数量决策；各核partial生产；workspace写读与最终merge",
          "kind": "stage",
          "name": "stage",
          "required": true
        },
        {
          "description": "绑定shape、dtype、layout、feature与有效元素域，不跨workload借证据",
          "kind": "workload",
          "name": "workload",
          "required": true
        },
        {
          "description": "绑定当前parent源码、host/tiling/kernel、编译配置或artifact身份",
          "kind": "implementation",
          "name": "implementation",
          "required": true
        }
      ],
      "source_path": "skills/ascendc-aprof-diagnosis/graph/problems/problem.chunk_merge_overhead.md",
      "source_hash": "sha256:0b61ae1aaad92e8293616ac532b6dacd941e6eef32b1d7c116b8b392c6835b5e",
      "review": {
        "discriminating_power": "比较saved_critical_path与partial_write+sync+read+merge，而非只比较活跃核数；检查局部独立归并是否可在跨核同步前完成；分段仍显著缩短全链关键路径时，不能因存在merge就判过度",
        "gaps": [
          "尚无当前任务同scope的profiling关联或独立硬件复核；所有效果为prediction。",
          "Split-K、Split-KV与排序merge的数学合并不同，不能直接替换算法",
          "本轮只有来源推导，无段数最优值或收益承诺"
        ],
        "observed_frequency": "unknown",
        "source_credibility": "固定修订的API文档、策略说明或公开代码；新claim独立引用本包来源与行号。旧迁移引用只作为legacy_seed，仓库名不自动等于硬件证明。",
        "state": "reviewed_with_limits"
      }
    },
    {
      "id": "problem.control_metadata_overhead",
      "title": "循环控制与元数据开销",
      "mechanism": "循环不变字段或公共地址前缀在每轮重复加载/计算 → Scalar为同一信息反复执行解引用、乘除或分支 → 指令发射被控制工作占用而拖慢有效流水",
      "mechanism_summary": "循环不变字段或公共地址前缀在每轮重复加载/计算 → Scalar为同一信息反复执行解引用、乘除或分支 → 指令发射被控制工作占用而拖慢有效流水",
      "alternatives": [
        {
          "check": "按PC定位mask/index/metadata或元素load算术",
          "distinction": "重复控制与逐元素数据处理不同",
          "problem_id": "problem.scalar_control_hot_loop"
        },
        {
          "check": "前后核对编译spill与热循环LoadStore",
          "distinction": "外提变量可能延长生存期并诱发spill",
          "problem_id": "problem.register_spill"
        }
      ],
      "discriminating_checks": [
        "区分按任务变化、按tile变化与循环常量，不能全局缓存动态字段",
        "编译器已折叠/外提或字段随loop变化时，源码重复不等于运行重复成本"
      ],
      "scope_status": "match",
      "scope": {
        "dtypes": [
          "all"
        ],
        "platforms": [
          "all"
        ],
        "workloads": [
          "all"
        ]
      },
      "slots": [
        {
          "description": "热循环中重复读取的TilingData字段、mask、索引和分支",
          "kind": "object",
          "name": "target",
          "required": true
        },
        {
          "description": "host元数据定义；kernel Init与主循环",
          "kind": "stage",
          "name": "stage",
          "required": true
        },
        {
          "description": "绑定shape、dtype、layout、feature与有效元素域，不跨workload借证据",
          "kind": "workload",
          "name": "workload",
          "required": true
        },
        {
          "description": "绑定当前parent源码、host/tiling/kernel、编译配置或artifact身份",
          "kind": "implementation",
          "name": "implementation",
          "required": true
        }
      ],
      "source_path": "skills/ascendc-aprof-diagnosis/graph/problems/problem.control_metadata_overhead.md",
      "source_hash": "sha256:d0abe417c2a011184aa8351d5ca1433d987d7ed3a36eb195b9f912661234a1e4",
      "review": {
        "discriminating_power": "区分按任务变化、按tile变化与循环常量，不能全局缓存动态字段；将TilingData大结构拷贝与少量热点字段重复读取分别核算；编译器已折叠/外提或字段随loop变化时，源码重复不等于运行重复成本",
        "gaps": [
          "尚无当前任务同scope的profiling关联或独立硬件复核；所有效果为prediction。",